{"artifact_id":"canonical_promotion-promotion-2026-02-01","artifact_schema":"paa-decision-artifact/0.1.0-draft","decision":{"from_position":"hitl","kind":"promotion","outcome":"ineligible","to_position":"hotl"},"declaration_version":1,"excluded_evidence":[],"generated_at":"2026-02-01T00:00:00.000Z","included_evidence":[],"policy":{"id":"canonical_promotion_report","version":"1"},"population":{"limit":50,"snapshot_at":"2026-02-01T00:00:00.000Z","total_qualifying":12},"scope":null,"source_references":["audit:canonical-window-2026-02-01"],"task":"canonical_promotion","window":{"kind":"cases","observed_from":"2026-01-15T00:00:00.000Z","observed_to":"2026-02-01T00:00:00.000Z","size":50}}
