{"artifact_id":"inbound_reply_surfacing-promotion-2026-01-08","artifact_schema":"paa-decision-artifact/0.1.0-draft","decision":{"from_position":"hitl","kind":"promotion","outcome":"eligible","to_position":"hotl"},"declaration_version":1,"excluded_evidence":[{"evidence_ref":"evidence/paa/068135e041fca31c799f00305ab3bc34493a4fca84ccae74d541f863dfb8a642/evidence.json","evidence_sha256":"068135e041fca31c799f00305ab3bc34493a4fca84ccae74d541f863dfb8a642","reason":"missing_human_gold_verification"}],"generated_at":"2026-01-08T00:05:00.000Z","included_evidence":[{"evidence_ref":"evidence/paa/cd85082f0ef66db18183acd3e350668078d31cbb6ff68683a9efcb552157662c/evidence.json","evidence_sha256":"cd85082f0ef66db18183acd3e350668078d31cbb6ff68683a9efcb552157662c"},{"evidence_ref":"evidence/paa/fb69c8b1a7a2db24046cdaa90fafe6ddfb98440246e45f10361e15bf73e34b23/evidence.json","evidence_sha256":"fb69c8b1a7a2db24046cdaa90fafe6ddfb98440246e45f10361e15bf73e34b23"}],"policy":{"id":"phase1_audit","version":"1"},"population":{"limit":50,"snapshot_at":"2026-01-08T00:05:00.000Z","total_qualifying":2},"scope":null,"source_references":["case:1001","case:1002"],"task":"inbound_reply_surfacing","window":{"kind":"duration","observed_from":"2025-12-25T00:00:00.000Z","observed_to":"2026-01-08T00:00:00.000Z","size":"P14D"}}
