{"artifact_id":"refund_approval-demotion-2026-04-10","artifact_schema":"paa-decision-artifact/0.1.0-draft","decision":{"from_position":"hotl","kind":"demotion","outcome":"eligible","to_position":"hitl"},"declaration_version":1,"excluded_evidence":[],"generated_at":"2026-04-10T00:00:00.000Z","included_evidence":[],"policy":{"id":"chargebacks_or_complaints_exceed_bound","version":"1"},"population":{"limit":1,"snapshot_at":"2026-04-10T00:00:00.000Z","total_qualifying":1},"scope":null,"source_references":["case:refund-9981-chargeback"],"task":"refund_approval","window":{"kind":"cases","observed_from":"2026-04-10T00:00:00.000Z","observed_to":"2026-04-10T00:00:00.000Z","size":1}}
