{"artifact_id":"outbound_content_publish-promotion-bluesky-2026-03-01","artifact_schema":"paa-decision-artifact/0.1.0-draft","decision":{"from_position":"hitl","kind":"promotion","outcome":"eligible","to_position":"hotl"},"declaration_version":1,"excluded_evidence":[],"generated_at":"2026-03-01T00:00:00.000Z","included_evidence":[],"policy":{"id":"outbound_publish_promotion_report","version":"2"},"population":{"limit":50,"snapshot_at":"2026-03-01T00:00:00.000Z","total_qualifying":50},"scope":"publish:bluesky","source_references":["scope:publish:bluesky"],"task":"outbound_content_publish","window":{"kind":"cases","observed_from":"2026-01-15T00:00:00.000Z","observed_to":"2026-03-01T00:00:00.000Z","size":50}}
