{"artifact_id":"refund_approval-promotion-2026-04-01","artifact_schema":"paa-decision-artifact/0.1.0-draft","decision":{"from_position":"hitl","kind":"promotion","outcome":"eligible","to_position":"hotl"},"declaration_version":1,"excluded_evidence":[],"generated_at":"2026-04-01T00:00:00.000Z","included_evidence":[],"policy":{"id":"refund_approval_promotion_report","version":"1"},"population":{"limit":200,"snapshot_at":"2026-04-01T00:00:00.000Z","total_qualifying":200},"scope":null,"source_references":["window:refund-2026-Q1"],"task":"refund_approval","window":{"kind":"cases","observed_from":"2026-02-01T00:00:00.000Z","observed_to":"2026-04-01T00:00:00.000Z","size":200}}
